{
  "schemaVersion": 1,
  "contractRevision": "hiverelay-v2-p0.9",
  "caseId": "v2.x25519.host-key.valid",
  "suite": "hiverelay-v2-conformance",
  "operation": "x25519-key",
  "applicableComponents": ["cloud", "hivecode", "cell"],
  "validationTime": 1893456000000,
  "input": {"publicKeyB64Url": "11qYAYKxCrfVS_7TyWQHOg7hcvPapiMlrwIaaPcHURo", "relayHostId": "If4x36FUomFia_hU"}
}
